{
  "schema_revision": "gooseweb-phase-graph-seed/v8",
  "approved_plan_sha256": "521073ac7551df15d814b1e84d1be47ec9e80289728d07c3dbab8c5b2b1b3b2c",
  "authority_split": {
    "tracked_role": "immutable_phase_graph_candidate_intent_and_lifecycle_seed",
    "snapshot_cutoff": "2026-07-12T06:55:00.000Z",
    "external_attestation_schema": "verification/gooseweb/schemas/lifecycle-attestation.schema.json",
    "external_attestation_location": "tmp/gg/gooseweb-migration/lifecycle-attestation.json",
    "effective_state_rule": "seed_overlaid_by_validated_append_only_external_attestations",
    "post_review_tracked_mutation_prohibited": true
  },
  "manifest_registry": {
    "path": "verification/gooseweb/manifest-registry.json",
    "schema_revision": "gooseweb-manifest-registry/v1",
    "sha256": "7e4b23453c23c0e34f1a6515f7233f6713610033f63b0122112e78babeaef6d1"
  },
  "phases": [
    {
      "phase_id": "P00",
      "prerequisites": [],
      "state": "cleared",
      "state_reason": "Independent exact-plan audit cleared.",
      "history": []
    },
    {
      "phase_id": "P01",
      "prerequisites": ["P00"],
      "state": "candidate_ready_for_review",
      "state_reason": "P01 reusable-contract fix addresses attempt-6 findings and awaits exact-head review.",
      "history": [
        {
          "sequence": 1,
          "from": "blocked",
          "to": "implementing",
          "at": "2026-07-12T04:30:00.000Z",
          "reason": "P00 cleared and P01 implementation was assigned.",
          "lease_id": null,
          "clearance_ref": null
        },
        {
          "sequence": 2,
          "from": "implementing",
          "to": "candidate_ready_for_review",
          "at": "2026-07-12T05:15:00.000Z",
          "reason": "Initial clean committed candidate handed off.",
          "lease_id": null,
          "clearance_ref": null
        },
        {
          "sequence": 3,
          "from": "candidate_ready_for_review",
          "to": "under_review",
          "at": "2026-07-12T05:22:17.000Z",
          "reason": "Supervisor acquired the sole migration stack lease.",
          "lease_id": "gooseweb-migration-000001",
          "clearance_ref": null
        },
        {
          "sequence": 4,
          "from": "under_review",
          "to": "changes_required",
          "at": "2026-07-12T05:40:49.000Z",
          "reason": "Independent review issued blocking findings; no clearance was issued.",
          "lease_id": "gooseweb-migration-000001",
          "clearance_ref": "tmp/gg/gooseweb-migration/P01/7adbae8/attempt-2/clearance-not-issued.json"
        },
        {
          "sequence": 5,
          "from": "changes_required",
          "to": "implementing",
          "at": "2026-07-12T05:41:00.000Z",
          "reason": "Lease termination, cleanup, and release were confirmed before mutation resumed.",
          "lease_id": null,
          "clearance_ref": null
        },
        {
          "sequence": 6,
          "from": "implementing",
          "to": "candidate_ready_for_review",
          "at": "2026-07-12T05:50:00.000Z",
          "reason": "Fix candidate implemented and queued for a fresh exact-head review.",
          "lease_id": null,
          "clearance_ref": null
        },
        {
          "sequence": 7,
          "from": "candidate_ready_for_review",
          "to": "under_review",
          "at": "2026-07-12T05:57:36.000Z",
          "reason": "Supervisor acquired the sole migration stack lease for replacement attempt 3.",
          "lease_id": "gooseweb-migration-000002",
          "clearance_ref": null
        },
        {
          "sequence": 8,
          "from": "under_review",
          "to": "changes_required",
          "at": "2026-07-12T06:01:43.000Z",
          "reason": "Replacement review issued blocking findings; no clearance was issued.",
          "lease_id": "gooseweb-migration-000002",
          "clearance_ref": "tmp/gg/gooseweb-migration/P01/a8eb441/attempt-3/report.md"
        },
        {
          "sequence": 9,
          "from": "changes_required",
          "to": "implementing",
          "at": "2026-07-12T06:01:44.000Z",
          "reason": "Lease termination, cleanup, and release were confirmed before the second fix round.",
          "lease_id": null,
          "clearance_ref": null
        },
        {
          "sequence": 10,
          "from": "implementing",
          "to": "candidate_ready_for_review",
          "at": "2026-07-12T06:10:00.000Z",
          "reason": "Second fix candidate implemented and queued for a fresh exact-head review.",
          "lease_id": null,
          "clearance_ref": null
        },
        {
          "sequence": 11,
          "from": "candidate_ready_for_review",
          "to": "under_review",
          "at": "2026-07-12T06:15:26.000Z",
          "reason": "Supervisor acquired the sole migration stack lease for replacement attempt 4.",
          "lease_id": "gooseweb-migration-000003",
          "clearance_ref": null
        },
        {
          "sequence": 12,
          "from": "under_review",
          "to": "changes_required",
          "at": "2026-07-12T06:19:24.000Z",
          "reason": "Replacement attempt 4 issued blocking findings; no clearance was issued.",
          "lease_id": "gooseweb-migration-000003",
          "clearance_ref": "tmp/gg/gooseweb-migration/P01/b40131f/attempt-4/report.md"
        },
        {
          "sequence": 13,
          "from": "changes_required",
          "to": "implementing",
          "at": "2026-07-12T06:19:25.000Z",
          "reason": "Lease termination, cleanup, and release were confirmed before mutation resumed.",
          "lease_id": null,
          "clearance_ref": null
        },
        {
          "sequence": 14,
          "from": "implementing",
          "to": "candidate_ready_for_review",
          "at": "2026-07-12T06:25:00.000Z",
          "reason": "Third fix candidate implemented and queued for a fresh exact-head review.",
          "lease_id": null,
          "clearance_ref": null
        },
        {
          "sequence": 15,
          "from": "candidate_ready_for_review",
          "to": "under_review",
          "at": "2026-07-12T06:28:43.000Z",
          "reason": "Supervisor acquired the sole migration stack lease for replacement attempt 5.",
          "lease_id": "gooseweb-migration-000004",
          "clearance_ref": null
        },
        {
          "sequence": 16,
          "from": "under_review",
          "to": "changes_required",
          "at": "2026-07-12T06:32:17.000Z",
          "reason": "Replacement attempt 5 issued blocking findings; no clearance was issued.",
          "lease_id": "gooseweb-migration-000004",
          "clearance_ref": "tmp/gg/gooseweb-migration/P01/d7da340/attempt-5/report.md"
        },
        {
          "sequence": 17,
          "from": "changes_required",
          "to": "implementing",
          "at": "2026-07-12T06:32:18.000Z",
          "reason": "Lease termination, cleanup, and release were confirmed before mutation resumed.",
          "lease_id": null,
          "clearance_ref": null
        },
        {
          "sequence": 18,
          "from": "implementing",
          "to": "candidate_ready_for_review",
          "at": "2026-07-12T06:37:00.000Z",
          "reason": "Fourth fix candidate implemented and queued for a fresh exact-head review.",
          "lease_id": null,
          "clearance_ref": null
        },
        {
          "sequence": 19,
          "from": "candidate_ready_for_review",
          "to": "under_review",
          "at": "2026-07-12T06:39:30.000Z",
          "reason": "Supervisor acquired the sole migration stack lease for code-review attempt 6.",
          "lease_id": "gooseweb-migration-000005",
          "clearance_ref": null
        },
        {
          "sequence": 20,
          "from": "under_review",
          "to": "changes_required",
          "at": "2026-07-12T06:41:05.000Z",
          "reason": "Attempt 6 stopped on reusable-contract findings before browser attachment; no clearance was issued.",
          "lease_id": "gooseweb-migration-000005",
          "clearance_ref": "tmp/gg/p01-acceptance-foundation-review.md"
        },
        {
          "sequence": 21,
          "from": "changes_required",
          "to": "implementing",
          "at": "2026-07-12T06:41:06.000Z",
          "reason": "Lease termination, cleanup, and release were confirmed before mutation resumed.",
          "lease_id": null,
          "clearance_ref": null
        },
        {
          "sequence": 22,
          "from": "implementing",
          "to": "candidate_ready_for_review",
          "at": "2026-07-12T06:55:00.000Z",
          "reason": "Reusable P01-P56 contract fix implemented and queued for exact-head review.",
          "lease_id": null,
          "clearance_ref": null
        }
      ]
    },
    {
      "phase_id": "P02",
      "prerequisites": ["P01"],
      "state": "blocked",
      "state_reason": "Exact prerequisites have not all cleared.",
      "history": []
    },
    {
      "phase_id": "P03",
      "prerequisites": ["P01", "P02"],
      "state": "blocked",
      "state_reason": "Exact prerequisites have not all cleared.",
      "history": []
    },
    {
      "phase_id": "P04",
      "prerequisites": ["P02", "P03"],
      "state": "blocked",
      "state_reason": "Exact prerequisites have not all cleared.",
      "history": []
    },
    {
      "phase_id": "P05",
      "prerequisites": ["P03", "P04"],
      "state": "blocked",
      "state_reason": "Exact prerequisites have not all cleared.",
      "history": []
    },
    {
      "phase_id": "P06",
      "prerequisites": ["P02", "P04"],
      "state": "blocked",
      "state_reason": "Exact prerequisites have not all cleared.",
      "history": []
    },
    {
      "phase_id": "P07",
      "prerequisites": ["P06"],
      "state": "blocked",
      "state_reason": "Exact prerequisites have not all cleared.",